Packet: Ether / IP / TCP 192.168.9.2:60824 > 194.135.85.48:https PA / Raw | Protocol: tcp | Encryption: TLS (HTTPS)
Packet: Ether / IP / TCP 194.135.85.48:https > 192.168.9.2:60824 PA / Raw | Protocol: tcp | Encryption: TLS (HTTPS)
Packet: Ether / IP / TCP 192.168.9.2:60824 > 194.135.85.48:https A | Protocol: tcp | Encryption: TLS (HTTPS)
Packet: Ether / IP / TCP 192.168.9.2:60827 > 149.154.167.50:https PA / Raw | Protocol: tcp | Encryption: TLS (HTTPS)
Packet: Ether / IP / TCP 149.154.167.50:https > 192.168.9.2:60827 A / Padding | Protocol: tcp | Encryption: TLS (HTTPS)
Packet: Ether / IP / TCP 149.154.167.50:https > 192.168.9.2:60827 A / Raw | Protocol: tcp | Encryption: TLS (HTTPS)
Packet: Ether / IP / TCP 149.154.167.50:https > 192.168.9.2:60827 A / Raw | Protocol: tcp | Encryption: TLS (HTTPS)
Packet: Ether / IP / TCP 192.168.9.2:60827 > 149.154.167.50:https A | Protocol: tcp | Encryption: TLS (HTTPS)
Packet: Ether / IP / TCP 149.154.167.50:https > 192.168.9.2:60827 A / Raw | Protocol: tcp | Encryption: TLS (HTTPS)
Packet: Ether / IP / TCP 149.154.167.50:https > 192.168.9.2:60827 A / Raw | Protocol: tcp | Encryption: TLS (HTTPS)
Packet: Ether / IP / TCP 192.168.9.2:60827 > 149.154.167.50:https A | Protocol: tcp | Encryption: TLS (HTTPS)
Packet: Ether / IP / TCP 149.154.167.50:https > 192.168.9.2:60827 A / Raw | Protocol: tcp | Encryption: TLS (HTTPS)
Packet: Ether / IP / TCP 149.154.167.50:https > 192.168.9.2:60827 A / Raw | Protocol: tcp | Encryption: TLS (HTTPS)
Packet: Ether / IP / TCP 192.168.9.2:60827 > 149.154.167.50:https A | Protocol: tcp | Encryption: TLS (HTTPS)
Packet: Ether / IP / TCP 149.154.167.50:https > 192.168.9.2:60827 A / Raw | Protocol: tcp | Encryption: TLS (HTTPS)
Packet: Ether / IP / TCP 149.154.167.50:https > 192.168.9.2:60827 A / Raw | Protocol: tcp | Encryption: TLS (HTTPS)
Packet: Ether / IP / TCP 192.168.9.2:60827 > 149.154.167.50:https A | Protocol: tcp | Encryption: TLS (HTTPS)
Packet: Ether / IP / TCP 149.154.167.50:https > 192.168.9.2:60827 A / Raw | Protocol: tcp | Encryption: TLS (HTTPS)
Packet: Ether / IP / TCP 149.154.167.50:https > 192.168.9.2:60827 A / Raw | Protocol: tcp | Encryption: TLS (HTTPS)
Packet: Ether / IP / TCP 192.168.9.2:60827 > 149.154.167.50:https A | Protocol: tcp | Encryption: TLS (HTTPS)
Packet: Ether / IP / TCP 149.154.167.50:https > 192.168.9.2:60827 A / Raw | Protocol: tcp | Encryption: TLS (HTTPS)
Packet: Ether / IP / TCP 149.154.167.50:https > 192.168.9.2:60827 PA / Raw | Protocol: tcp | Encryption: TLS (HTTPS)
Packet: Ether / IP / TCP 192.168.9.2:60827 > 149.154.167.50:https A | Protocol: tcp | Encryption: TLS (HTTPS)
Packet: Ether / IP / TCP 192.168.9.2:60766 > 204.80.128.1:https PA / Raw | Protocol: tcp | Encryption: TLS (HTTPS)
Packet: Ether / IP / TCP 204.80.128.1:https > 192.168.9.2:60766 A / Padding | Protocol: tcp | Encryption: TLS (HTTPS)
Packet: Ether / IP / TCP 192.168.9.2:60766 > 204.80.128.1:https PA / Raw | Protocol: tcp | Encryption: TLS (HTTPS)
Packet: Ether / IP / TCP 204.80.128.1:https > 192.168.9.2:60766 A / Padding | Protocol: tcp | Encryption: TLS (HTTPS)
Packet: Ether / IP / TCP 192.168.9.2:59697 > 135.225.242.134:https PA / Raw | Protocol: tcp | Encryption: TLS (HTTPS)
Packet: Ether / IP / TCP 135.225.242.134:https > 192.168.9.2:59697 PA / Raw | Protocol: tcp | Encryption: TLS (HTTPS)
Packet: Ether / IP / TCP 192.168.9.2:59697 > 135.225.242.134:https A | Protocol: tcp | Encryption: TLS (HTTPS)
Packet: Ether / IP / TCP 192.168.9.2:60824 > 194.135.85.48:https PA / Raw | Protocol: tcp | Encryption: TLS (HTTPS)
Packet: Ether / IP / TCP 194.135.85.48:https > 192.168.9.2:60824 PA / Raw | Protocol: tcp | Encryption: TLS (HTTPS)
Packet: Ether / IP / TCP 192.168.9.2:60824 > 194.135.85.48:https A | Protocol: tcp | Encryption: TLS (HTTPS)
Packet: Ether / IP / TCP 192.168.9.2:60825 > 194.135.85.48:https A / Raw | Protocol: tcp | Encryption: TLS (HTTPS)
Packet: Ether / IP / TCP 194.135.85.48:https > 192.168.9.2:60825 A | Protocol: tcp | Encryption: TLS (HTTPS)
Packet: Ether / IP / TCP 192.168.9.2:63892 > 193.0.160.130:https A / Raw | Protocol: tcp | Encryption: TLS (HTTPS)
Packet: Ether / IP / TCP 193.0.160.130:https > 192.168.9.2:63892 A / Padding | Protocol: tcp | Encryption: TLS (HTTPS)
Packet: Ether / IP / TCP 192.168.9.2:60766 > 204.80.128.1:https PA / Raw | Protocol: tcp | Encryption: TLS (HTTPS)
Packet: Ether / IP / TCP 204.80.128.1:https > 192.168.9.2:60766 A / Padding | Protocol: tcp | Encryption: TLS (HTTPS)
Packet: Ether / IP / TCP 192.168.9.2:60766 > 204.80.128.1:https PA / Raw | Protocol: tcp | Encryption: TLS (HTTPS)
Packet: Ether / IP / TCP 204.80.128.1:https > 192.168.9.2:60766 A / Padding | Protocol: tcp | Encryption: TLS (HTTPS)
Packet: Ether / IP / TCP 192.168.9.2:60824 > 194.135.85.48:https PA / Raw | Protocol: tcp | Encryption: TLS (HTTPS)
Packet: Ether / IP / TCP 194.135.85.48:https > 192.168.9.2:60824 PA / Raw | Protocol: tcp | Encryption: TLS (HTTPS)
Packet: Ether / IP / TCP 192.168.9.2:60824 > 194.135.85.48:https A | Protocol: tcp | Encryption: TLS (HTTPS)
Packet: Ether / IP / TCP 192.168.9.2:59492 > 35.174.127.31:https PA / Raw | Protocol: tcp | Encryption: TLS (HTTPS)
Packet: Ether / IP / TCP 192.168.9.2:60827 > 149.154.167.50:https PA / Raw | Protocol: tcp | Encryption: TLS (HTTPS)
Packet: Ether / IP / TCP 149.154.167.50:https > 192.168.9.2:60827 A / Padding | Protocol: tcp | Encryption: TLS (HTTPS)
Packet: Ether / IP / TCP 35.174.127.31:https > 192.168.9.2:59492 PA / Raw | Protocol: tcp | Encryption: TLS (HTTPS)
Packet: Ether / IP / TCP 149.154.167.50:https > 192.168.9.2:60827 A / Raw | Protocol: tcp | Encryption: TLS (HTTPS)
Packet: Ether / IP / TCP 149.154.167.50:https > 192.168.9.2:60827 PA / Raw | Protocol: tcp | Encryption: TLS (HTTPS)
Packet: Ether / IP / TCP 192.168.9.2:60827 > 149.154.167.50:https A | Protocol: tcp | Encryption: TLS (HTTPS)
Packet: Ether / IP / TCP 192.168.9.2:60827 > 149.154.167.50:https PA / Raw | Protocol: tcp | Encryption: TLS (HTTPS)
Packet: Ether / IP / TCP 192.168.9.2:59492 > 35.174.127.31:https A | Protocol: tcp | Encryption: TLS (HTTPS)
Packet: Ether / IP / TCP 149.154.167.50:https > 192.168.9.2:60827 A / Padding | Protocol: tcp | Encryption: TLS (HTTPS)
Packet: Ether / IP / TCP 192.168.9.2:60766 > 204.80.128.1:https PA / Raw | Protocol: tcp | Encryption: TLS (HTTPS)
Packet: Ether / IP / TCP 192.168.9.2:60824 > 194.135.85.48:https PA / Raw | Protocol: tcp | Encryption: TLS (HTTPS)
Packet: Ether / IP / TCP 204.80.128.1:https > 192.168.9.2:60766 A / Padding | Protocol: tcp | Encryption: TLS (HTTPS)
Packet: Ether / IP / TCP 192.168.9.2:60766 > 204.80.128.1:https PA / Raw | Protocol: tcp | Encryption: TLS (HTTPS)
Packet: Ether / IP / TCP 192.168.9.2:60070 > 52.7.165.190:https A / Raw | Protocol: tcp | Encryption: TLS (HTTPS)
Packet: Ether / IP / TCP 204.80.128.1:https > 192.168.9.2:60766 A / Padding | Protocol: tcp | Encryption: TLS (HTTPS)
Packet: Ether / IP / TCP 194.135.85.48:https > 192.168.9.2:60824 PA / Raw | Protocol: tcp | Encryption: TLS (HTTPS)
Packet: Ether / IP / TCP 172.217.16.10:https > 192.168.9.2:60869 PA / Raw | Protocol: tcp | Encryption: TLS (HTTPS)
Packet: Ether / IP / TCP 192.168.9.2:60824 > 194.135.85.48:https A | Protocol: tcp | Encryption: TLS (HTTPS)
Packet: Ether / IP / TCP 192.168.9.2:60869 > 172.217.16.10:https A | Protocol: tcp | Encryption: TLS (HTTPS)
Packet: Ether / IP / TCP 52.7.165.190:https > 192.168.9.2:60070 A | Protocol: tcp | Encryption: TLS (HTTPS)
Packet: Ether / IP / TCP 192.168.9.2:60824 > 194.135.85.48:https PA / Raw | Protocol: tcp | Encryption: TLS (HTTPS)
Packet: Ether / IP / TCP 194.135.85.48:https > 192.168.9.2:60824 PA / Raw | Protocol: tcp | Encryption: TLS (HTTPS)
Packet: Ether / IP / TCP 192.168.9.2:60824 > 194.135.85.48:https A | Protocol: tcp | Encryption: TLS (HTTPS)
Packet: Ether / IP / TCP 192.168.9.2:59678 > 135.225.242.134:https PA / Raw | Protocol: tcp | Encryption: TLS (HTTPS)
Packet: Ether / IP / TCP 135.225.242.134:https > 192.168.9.2:59678 PA / Raw | Protocol: tcp | Encryption: TLS (HTTPS)
Packet: Ether / IP / TCP 192.168.9.2:59994 > 140.82.112.25:https A / Raw | Protocol: tcp | Encryption: TLS (HTTPS)
Packet: Ether / IP / TCP 192.168.9.2:59678 > 135.225.242.134:https A | Protocol: tcp | Encryption: TLS (HTTPS)
Packet: Ether / IP / TCP 140.82.112.25:https > 192.168.9.2:59994 A | Protocol: tcp | Encryption: TLS (HTTPS)
Packet: Ether / IP / TCP 192.168.9.2:60766 > 204.80.128.1:https PA / Raw | Protocol: tcp | Encryption: TLS (HTTPS)
Packet: Ether / IP / TCP 204.80.128.1:https > 192.168.9.2:60766 A / Padding | Protocol: tcp | Encryption: TLS (HTTPS)
Packet: Ether / IP / TCP 192.168.9.2:60766 > 204.80.128.1:https PA / Raw | Protocol: tcp | Encryption: TLS (HTTPS)
Packet: Ether / IP / TCP 192.168.9.2:60766 > 204.80.128.1:https FA | Protocol: tcp | Encryption: TLS (HTTPS)
Packet: Ether / IP / TCP 204.80.128.1:https > 192.168.9.2:60766 A / Padding | Protocol: tcp | Encryption: TLS (HTTPS)
Packet: Ether / IP / TCP 204.80.128.1:https > 192.168.9.2:60766 FA / Padding | Protocol: tcp | Encryption: TLS (HTTPS)
Packet: Ether / IP / TCP 192.168.9.2:60766 > 204.80.128.1:https A | Protocol: tcp | Encryption: TLS (HTTPS)
Packet: Ether / IP / TCP 192.168.9.2:60843 > 194.135.85.48:https S | Protocol: tcp | Encryption: TLS (HTTPS)
Packet: Ether / IP / TCP 192.168.9.2:60844 > 194.135.85.48:https S | Protocol: tcp | Encryption: TLS (HTTPS)
Packet: Ether / IP / TCP 192.168.9.2:60824 > 194.135.85.48:https PA / Raw | Protocol: tcp | Encryption: TLS (HTTPS)
Packet: Ether / IP / TCP 192.168.9.2:60825 > 194.135.85.48:https PA / Raw | Protocol: tcp | Encryption: TLS (HTTPS)
Packet: Ether / IP / TCP 192.168.9.2:60845 > 44.218.155.151:https S | Protocol: tcp | Encryption: TLS (HTTPS)
Packet: Ether / IP / TCP 194.135.85.48:https > 192.168.9.2:60843 SA | Protocol: tcp | Encryption: TLS (HTTPS)
Packet: Ether / IP / TCP 192.168.9.2:60843 > 194.135.85.48:https A | Protocol: tcp | Encryption: TLS (HTTPS)
Packet: Ether / IP / TCP 194.135.85.48:https > 192.168.9.2:60844 SA | Protocol: tcp | Encryption: TLS (HTTPS)
Packet: Ether / IP / TCP 192.168.9.2:60844 > 194.135.85.48:https A | Protocol: tcp | Encryption: TLS (HTTPS)
Packet: Ether / IP / TCP 192.168.9.2:60843 > 194.135.85.48:https PA / Raw | Protocol: tcp | Encryption: TLS (HTTPS)
Packet: Ether / IP / TCP 192.168.9.2:60844 > 194.135.85.48:https PA / Raw | Protocol: tcp | Encryption: TLS (HTTPS)
Packet: Ether / IP / TCP 194.135.85.48:https > 192.168.9.2:60825 A / Padding | Protocol: tcp | Encryption: TLS (HTTPS)
Packet: Ether / IP / TCP 194.135.85.48:https > 192.168.9.2:60843 A / Padding | Protocol: tcp | Encryption: TLS (HTTPS)
Packet: Ether / IP / TCP 194.135.85.48:https > 192.168.9.2:60843 A / Padding | Protocol: tcp | Encryption: TLS (HTTPS)
Packet: Ether / IP / TCP 194.135.85.48:https > 192.168.9.2:60844 A / Padding | Protocol: tcp | Encryption: TLS (HTTPS)
Packet: Ether / IP / TCP 194.135.85.48:https > 192.168.9.2:60844 A / Padding | Protocol: tcp | Encryption: TLS (HTTPS)
Packet: Ether / IP / TCP 194.135.85.48:https > 192.168.9.2:60844 PA / Raw | Protocol: tcp | Encryption: TLS (HTTPS)
Packet: Ether / IP / TCP 194.135.85.48:https > 192.168.9.2:60843 PA / Raw | Protocol: tcp | Encryption: TLS (HTTPS)
Packet: Ether / IP / TCP 194.135.85.48:https > 192.168.9.2:60824 PA / Raw | Protocol: tcp | Encryption: TLS (HTTPS)
Packet: Ether / IP / TCP 192.168.9.2:60844 > 194.135.85.48:https PA / Raw | Protocol: tcp | Encryption: TLS (HTTPS)
Packet: Ether / IP / TCP 192.168.9.2:60843 > 194.135.85.48:https PA / Raw | Protocol: tcp | Encryption: TLS (HTTPS)
Packet: Ether / IP / TCP 192.168.9.2:60844 > 194.135.85.48:https PA / Raw | Protocol: tcp | Encryption: TLS (HTTPS)
Packet: Ether / IP / TCP 192.168.9.2:60843 > 194.135.85.48:https PA / Raw | Protocol: tcp | Encryption: TLS (HTTPS)
Packet: Ether / IP / TCP 194.135.85.48:https > 192.168.9.2:60825 PA / Raw | Protocol: tcp | Encryption: TLS (HTTPS)
Packet: Ether / IP / TCP 194.135.85.48:https > 192.168.9.2:60843 A / Padding | Protocol: tcp | Encryption: TLS (HTTPS)
Packet: Ether / IP / TCP 194.135.85.48:https > 192.168.9.2:60844 A / Padding | Protocol: tcp | Encryption: TLS (HTTPS)
Packet: Ether / IP / TCP 192.168.9.2:60824 > 194.135.85.48:https A | Protocol: tcp | Encryption: TLS (HTTPS)
Packet: Ether / IP / TCP 194.135.85.48:https > 192.168.9.2:60843 PA / Raw | Protocol: tcp | Encryption: TLS (HTTPS)
Packet: Ether / IP / TCP 194.135.85.48:https > 192.168.9.2:60844 PA / Raw | Protocol: tcp | Encryption: TLS (HTTPS)
Packet: Ether / IP / TCP 192.168.9.2:60825 > 194.135.85.48:https A | Protocol: tcp | Encryption: TLS (HTTPS)
Packet: Ether / IP / TCP 44.218.155.151:https > 192.168.9.2:60845 SA | Protocol: tcp | Encryption: TLS (HTTPS)
Packet: Ether / IP / TCP 192.168.9.2:60845 > 44.218.155.151:https A | Protocol: tcp | Encryption: TLS (HTTPS)
Packet: Ether / IP / TCP 192.168.9.2:60845 > 44.218.155.151:https PA / Raw | Protocol: tcp | Encryption: TLS (HTTPS)
Packet: Ether / IP / TCP 192.168.9.2:60843 > 194.135.85.48:https A | Protocol: tcp | Encryption: TLS (HTTPS)
Packet: Ether / IP / TCP 192.168.9.2:60844 > 194.135.85.48:https A | Protocol: tcp | Encryption: TLS (HTTPS)
Packet: Ether / IP / TCP 44.218.155.151:https > 192.168.9.2:60845 A / Padding | Protocol: tcp | Encryption: TLS (HTTPS)
Packet: Ether / IP / TCP 44.218.155.151:https > 192.168.9.2:60845 A / Raw | Protocol: tcp | Encryption: TLS (HTTPS)
Packet: Ether / IP / TCP 44.218.155.151:https > 192.168.9.2:60845 A / Raw | Protocol: tcp | Encryption: TLS (HTTPS)
Packet: Ether / IP / TCP 192.168.9.2:60845 > 44.218.155.151:https A | Protocol: tcp | Encryption: TLS (HTTPS)
Packet: Ether / IP / TCP 44.218.155.151:https > 192.168.9.2:60845 A / Raw | Protocol: tcp | Encryption: TLS (HTTPS)
Packet: Ether / IP / TCP 44.218.155.151:https > 192.168.9.2:60845 PA / Raw / Padding | Protocol: tcp | Encryption: TLS (HTTPS)
Packet: Ether / IP / TCP 192.168.9.2:60845 > 44.218.155.151:https A | Protocol: tcp | Encryption: TLS (HTTPS)
Packet: Ether / IP / TCP 192.168.9.2:60845 > 44.218.155.151:https PA / Raw | Protocol: tcp | Encryption: TLS (HTTPS)
Packet: Ether / IP / TCP 44.218.155.151:https > 192.168.9.2:60845 A / Padding | Protocol: tcp | Encryption: TLS (HTTPS)
Packet: Ether / IP / TCP 44.218.155.151:https > 192.168.9.2:60845 PA / Raw | Protocol: tcp | Encryption: TLS (HTTPS)
Packet: Ether / IP / TCP 192.168.9.2:60845 > 44.218.155.151:https PA / Raw | Protocol: tcp | Encryption: TLS (HTTPS)
Packet: Ether / IP / TCP 44.218.155.151:https > 192.168.9.2:60845 PA / Raw | Protocol: tcp | Encryption: TLS (HTTPS)
Packet: Ether / IP / TCP 44.218.155.151:https > 192.168.9.2:60845 FA / Padding | Protocol: tcp | Encryption: TLS (HTTPS)
Packet: Ether / IP / TCP 192.168.9.2:60845 > 44.218.155.151:https A | Protocol: tcp | Encryption: TLS (HTTPS)
Packet: Ether / IP / TCP 192.168.9.2:60845 > 44.218.155.151:https PA / Raw | Protocol: tcp | Encryption: TLS (HTTPS)
Packet: Ether / IP / TCP 192.168.9.2:60845 > 44.218.155.151:https FA | Protocol: tcp | Encryption: TLS (HTTPS)
Packet: Ether / IP / TCP 192.168.9.2:60846 > 44.218.155.151:https S | Protocol: tcp | Encryption: TLS (HTTPS)
Packet: Ether / IP / TCP 44.218.155.151:https > 192.168.9.2:60845 A / Padding | Protocol: tcp | Encryption: TLS (HTTPS)
Packet: Ether / IP / TCP 44.218.155.151:https > 192.168.9.2:60846 SA | Protocol: tcp | Encryption: TLS (HTTPS)
Packet: Ether / IP / TCP 192.168.9.2:60846 > 44.218.155.151:https A | Protocol: tcp | Encryption: TLS (HTTPS)
Packet: Ether / IP / TCP 192.168.9.2:60846 > 44.218.155.151:https PA / Raw | Protocol: tcp | Encryption: TLS (HTTPS)
Packet: Ether / IP / TCP 44.218.155.151:https > 192.168.9.2:60846 A / Padding | Protocol: tcp | Encryption: TLS (HTTPS)
Packet: Ether / IP / TCP 44.218.155.151:https > 192.168.9.2:60846 A / Padding | Protocol: tcp | Encryption: TLS (HTTPS)
Packet: Ether / IP / TCP 44.218.155.151:https > 192.168.9.2:60846 A / Raw | Protocol: tcp | Encryption: TLS (HTTPS)
Packet: Ether / IP / TCP 44.218.155.151:https > 192.168.9.2:60846 A / Raw | Protocol: tcp | Encryption: TLS (HTTPS)
Packet: Ether / IP / TCP 192.168.9.2:60846 > 44.218.155.151:https A | Protocol: tcp | Encryption: TLS (HTTPS)
Packet: Ether / IP / TCP 44.218.155.151:https > 192.168.9.2:60846 A / Raw | Protocol: tcp | Encryption: TLS (HTTPS)
Packet: Ether / IP / TCP 44.218.155.151:https > 192.168.9.2:60846 PA / Raw | Protocol: tcp | Encryption: TLS (HTTPS)
Packet: Ether / IP / TCP 192.168.9.2:60846 > 44.218.155.151:https A | Protocol: tcp | Encryption: TLS (HTTPS)
Packet: Ether / IP / TCP 192.168.9.2:60846 > 44.218.155.151:https PA / Raw | Protocol: tcp | Encryption: TLS (HTTPS)
Packet: Ether / IP / TCP 192.168.9.2:60846 > 44.218.155.151:https PA / Raw | Protocol: tcp | Encryption: TLS (HTTPS)
Packet: Ether / IP / TCP 192.168.9.2:60846 > 44.218.155.151:https PA / Raw | Protocol: tcp | Encryption: TLS (HTTPS)
Packet: Ether / IP / TCP 44.218.155.151:https > 192.168.9.2:60846 A / Padding | Protocol: tcp | Encryption: TLS (HTTPS)
Packet: Ether / IP / TCP 44.218.155.151:https > 192.168.9.2:60846 A / Padding | Protocol: tcp | Encryption: TLS (HTTPS)
Packet: Ether / IP / TCP 44.218.155.151:https > 192.168.9.2:60846 PA / Raw | Protocol: tcp | Encryption: TLS (HTTPS)
Packet: Ether / IP / TCP 44.218.155.151:https > 192.168.9.2:60846 PA / Raw | Protocol: tcp | Encryption: TLS (HTTPS)
Packet: Ether / IP / TCP 192.168.9.2:60846 > 44.218.155.151:https A | Protocol: tcp | Encryption: TLS (HTTPS)
Packet: Ether / IP / TCP 192.168.9.2:60846 > 44.218.155.151:https PA / Raw | Protocol: tcp | Encryption: TLS (HTTPS)
Packet: Ether / IP / TCP 44.218.155.151:https > 192.168.9.2:60846 PA / Raw | Protocol: tcp | Encryption: TLS (HTTPS)
Packet: Ether / IP / TCP 44.218.155.151:https > 192.168.9.2:60846 PA / Raw | Protocol: tcp | Encryption: TLS (HTTPS)
Packet: Ether / IP / TCP 192.168.9.2:60846 > 44.218.155.151:https A | Protocol: tcp | Encryption: TLS (HTTPS)
Packet: Ether / IP / TCP 44.218.155.151:https > 192.168.9.2:60846 A / Padding | Protocol: tcp | Encryption: TLS (HTTPS)
Packet: Ether / IP / TCP 192.168.9.2:60844 > 194.135.85.48:https PA / Raw | Protocol: tcp | Encryption: TLS (HTTPS)
Packet: Ether / IP / TCP 194.135.85.48:https > 192.168.9.2:60844 PA / Raw | Protocol: tcp | Encryption: TLS (HTTPS)
Packet: Ether / IP / TCP 192.168.9.2:60844 > 194.135.85.48:https A | Protocol: tcp | Encryption: TLS (HTTPS)
Packet: Ether / IP / TCP 194.135.85.48:https > 192.168.9.2:60824 PA / Raw | Protocol: tcp | Encryption: TLS (HTTPS)
Packet: Ether / IP / TCP 194.135.85.48:https > 192.168.9.2:60824 FA / Padding | Protocol: tcp | Encryption: TLS (HTTPS)
Packet: Ether / IP / TCP 192.168.9.2:60824 > 194.135.85.48:https A | Protocol: tcp | Encryption: TLS (HTTPS)
Packet: Ether / IP / TCP 194.135.85.48:https > 192.168.9.2:60825 PA / Raw | Protocol: tcp | Encryption: TLS (HTTPS)
Packet: Ether / IP / TCP 194.135.85.48:https > 192.168.9.2:60825 FA / Padding | Protocol: tcp | Encryption: TLS (HTTPS)
Packet: Ether / IP / TCP 192.168.9.2:60825 > 194.135.85.48:https A | Protocol: tcp | Encryption: TLS (HTTPS)
Packet: Ether / IP / TCP 194.135.85.48:https > 192.168.9.2:60843 PA / Raw | Protocol: tcp | Encryption: TLS (HTTPS)
Packet: Ether / IP / TCP 194.135.85.48:https > 192.168.9.2:60843 FA / Padding | Protocol: tcp | Encryption: TLS (HTTPS)
Packet: Ether / IP / TCP 192.168.9.2:60843 > 194.135.85.48:https A | Protocol: tcp | Encryption: TLS (HTTPS)
Packet: Ether / IP / TCP 192.168.9.2:60873 > 40.126.53.7:https S | Protocol: tcp | Encryption: TLS (HTTPS)
Packet: Ether / IP / TCP 40.126.53.7:https > 192.168.9.2:60873 SA | Protocol: tcp | Encryption: TLS (HTTPS)
Packet: Ether / IP / TCP 192.168.9.2:60873 > 40.126.53.7:https A | Protocol: tcp | Encryption: TLS (HTTPS)
Packet: Ether / IP / TCP 192.168.9.2:60873 > 40.126.53.7:https PA / Raw | Protocol: tcp | Encryption: TLS (HTTPS)
Packet: Ether / IP / TCP 40.126.53.7:https > 192.168.9.2:60873 A / Raw | Protocol: tcp | Encryption: TLS (HTTPS)
Packet: Ether / IP / TCP 40.126.53.7:https > 192.168.9.2:60873 A / Raw | Protocol: tcp | Encryption: TLS (HTTPS)
Packet: Ether / IP / TCP 192.168.9.2:60873 > 40.126.53.7:https A | Protocol: tcp | Encryption: TLS (HTTPS)
Packet: Ether / IP / TCP 40.126.53.7:https > 192.168.9.2:60873 PA / Raw | Protocol: tcp | Encryption: TLS (HTTPS)
Packet: Ether / IP / TCP 192.168.9.2:60873 > 40.126.53.7:https PA / Raw | Protocol: tcp | Encryption: TLS (HTTPS)
Packet: Ether / IP / TCP 192.168.9.2:60827 > 149.154.167.50:https PA / Raw | Protocol: tcp | Encryption: TLS (HTTPS)
Packet: Ether / IP / TCP 40.126.53.7:https > 192.168.9.2:60873 PA / Raw | Protocol: tcp | Encryption: TLS (HTTPS)
Packet: Ether / IP / TCP 192.168.9.2:60873 > 40.126.53.7:https PA / Raw | Protocol: tcp | Encryption: TLS (HTTPS)
Packet: Ether / IP / TCP 192.168.9.2:60873 > 40.126.53.7:https PA / Raw | Protocol: tcp | Encryption: TLS (HTTPS)
Packet: Ether / IP / TCP 149.154.167.50:https > 192.168.9.2:60827 A / Padding | Protocol: tcp | Encryption: TLS (HTTPS)
Packet: Ether / IP / TCP 149.154.167.50:https > 192.168.9.2:60827 A / Raw | Protocol: tcp | Encryption: TLS (HTTPS)
Packet: Ether / IP / TCP 149.154.167.50:https > 192.168.9.2:60827 A / Raw | Protocol: tcp | Encryption: TLS (HTTPS)
Packet: Ether / IP / TCP 192.168.9.2:60827 > 149.154.167.50:https A | Protocol: tcp | Encryption: TLS (HTTPS)
Packet: Ether / IP / TCP 149.154.167.50:https > 192.168.9.2:60827 A / Raw | Protocol: tcp | Encryption: TLS (HTTPS)
Packet: Ether / IP / TCP 149.154.167.50:https > 192.168.9.2:60827 PA / Raw | Protocol: tcp | Encryption: TLS (HTTPS)
Packet: Ether / IP / TCP 192.168.9.2:60827 > 149.154.167.50:https A | Protocol: tcp | Encryption: TLS (HTTPS)
Packet: Ether / IP / TCP 40.126.53.7:https > 192.168.9.2:60873 A / Padding | Protocol: tcp | Encryption: TLS (HTTPS)
Packet: Ether / IP / TCP 40.126.53.7:https > 192.168.9.2:60873 A / Padding | Protocol: tcp | Encryption: TLS (HTTPS)
Packet: Ether / IP / TCP 40.126.53.7:https > 192.168.9.2:60873 A / Padding | Protocol: tcp | Encryption: TLS (HTTPS)
Packet: Ether / IP / TCP 149.154.167.50:https > 192.168.9.2:60827 PA / Raw | Protocol: tcp | Encryption: TLS (HTTPS)
Packet: Ether / IP / TCP 192.168.9.2:60827 > 149.154.167.50:https A | Protocol: tcp | Encryption: TLS (HTTPS)
Packet: Ether / IP / TCP 40.126.53.7:https > 192.168.9.2:60873 A / Raw | Protocol: tcp | Encryption: TLS (HTTPS)
Packet: Ether / IP / TCP 40.126.53.7:https > 192.168.9.2:60873 A / Raw | Protocol: tcp | Encryption: TLS (HTTPS)
Packet: Ether / IP / TCP 192.168.9.2:60873 > 40.126.53.7:https A | Protocol: tcp | Encryption: TLS (HTTPS)
Packet: Ether / IP / TCP 40.126.53.7:https > 192.168.9.2:60873 A / Raw | Protocol: tcp | Encryption: TLS (HTTPS)
Packet: Ether / IP / TCP 40.126.53.7:https > 192.168.9.2:60873 A / Raw | Protocol: tcp | Encryption: TLS (HTTPS)
Packet: Ether / IP / TCP 192.168.9.2:60873 > 40.126.53.7:https A | Protocol: tcp | Encryption: TLS (HTTPS)
Packet: Ether / IP / TCP 40.126.53.7:https > 192.168.9.2:60873 A / Raw | Protocol: tcp | Encryption: TLS (HTTPS)
Packet: Ether / IP / TCP 40.126.53.7:https > 192.168.9.2:60873 A / Raw | Protocol: tcp | Encryption: TLS (HTTPS)
Packet: Ether / IP / TCP 192.168.9.2:60873 > 40.126.53.7:https A | Protocol: tcp | Encryption: TLS (HTTPS)
Packet: Ether / IP / TCP 40.126.53.7:https > 192.168.9.2:60873 A / Raw | Protocol: tcp | Encryption: TLS (HTTPS)
Packet: Ether / IP / TCP 40.126.53.7:https > 192.168.9.2:60873 A / Raw | Protocol: tcp | Encryption: TLS (HTTPS)
Packet: Ether / IP / TCP 192.168.9.2:60873 > 40.126.53.7:https A | Protocol: tcp | Encryption: TLS (HTTPS)
Packet: Ether / IP / TCP 40.126.53.7:https > 192.168.9.2:60873 A / Raw | Protocol: tcp | Encryption: TLS (HTTPS)
Packet: Ether / IP / TCP 40.126.53.7:https > 192.168.9.2:60873 A / Raw | Protocol: tcp | Encryption: TLS (HTTPS)
Packet: Ether / IP / TCP 192.168.9.2:60873 > 40.126.53.7:https A | Protocol: tcp | Encryption: TLS (HTTPS)
Packet: Ether / IP / TCP 40.126.53.7:https > 192.168.9.2:60873 A / Raw | Protocol: tcp | Encryption: TLS (HTTPS)
Packet: Ether / IP / TCP 40.126.53.7:https > 192.168.9.2:60873 A / Raw | Protocol: tcp | Encryption: TLS (HTTPS)
Packet: Ether / IP / TCP 192.168.9.2:60873 > 40.126.53.7:https A | Protocol: tcp | Encryption: TLS (HTTPS)
Packet: Ether / IP / TCP 40.126.53.7:https > 192.168.9.2:60873 A / Raw | Protocol: tcp | Encryption: TLS (HTTPS)
Packet: Ether / IP / TCP 40.126.53.7:https > 192.168.9.2:60873 A / Raw | Protocol: tcp | Encryption: TLS (HTTPS)
Packet: Ether / IP / TCP 40.126.53.7:https > 192.168.9.2:60873 PA / Raw | Protocol: tcp | Encryption: TLS (HTTPS)
Packet: Ether / IP / TCP 192.168.9.2:60873 > 40.126.53.7:https A | Protocol: tcp | Encryption: TLS (HTTPS)
Packet: Ether / IP / TCP 192.168.9.2:60874 > 52.113.194.133:https S | Protocol: tcp | Encryption: TLS (HTTPS)
Packet: Ether / IP / TCP 192.168.9.2:60875 > 52.113.194.133:https S | Protocol: tcp | Encryption: TLS (HTTPS)
Packet: Ether / IP / TCP 192.168.9.2:60870 > 52.113.194.132:https PA / Raw | Protocol: tcp | Encryption: TLS (HTTPS)
Packet: Ether / IP / TCP 192.168.9.2:60870 > 52.113.194.132:https PA / Raw | Protocol: tcp | Encryption: TLS (HTTPS)
Packet: Ether / IP / TCP 192.168.9.2:60870 > 52.113.194.132:https PA / Raw | Protocol: tcp | Encryption: TLS (HTTPS)
Packet: Ether / IP / TCP 192.168.9.2:60870 > 52.113.194.132:https PA / Raw | Protocol: tcp | Encryption: TLS (HTTPS)
Packet: Ether / IP / TCP 192.168.9.2:60870 > 52.113.194.132:https PA / Raw | Protocol: tcp | Encryption: TLS (HTTPS)
Packet: Ether / IP / TCP 192.168.9.2:60870 > 52.113.194.132:https PA / Raw | Protocol: tcp | Encryption: TLS (HTTPS)
Packet: Ether / IP / TCP 52.113.194.133:https > 192.168.9.2:60875 SA | Protocol: tcp | Encryption: TLS (HTTPS)
Packet: Ether / IP / TCP 192.168.9.2:60875 > 52.113.194.133:https A | Protocol: tcp | Encryption: TLS (HTTPS)
Packet: Ether / IP / TCP 52.113.194.133:https > 192.168.9.2:60874 SA | Protocol: tcp | Encryption: TLS (HTTPS)
Packet: Ether / IP / TCP 192.168.9.2:60874 > 52.113.194.133:https A | Protocol: tcp | Encryption: TLS (HTTPS)
Packet: Ether / IP / TCP 192.168.9.2:60875 > 52.113.194.133:https PA / Raw | Protocol: tcp | Encryption: TLS (HTTPS)
Packet: Ether / IP / TCP 192.168.9.2:60874 > 52.113.194.133:https PA / Raw | Protocol: tcp | Encryption: TLS (HTTPS)
Packet: Ether / IP / TCP 52.113.194.132:https > 192.168.9.2:60870 A / Padding | Protocol: tcp | Encryption: TLS (HTTPS)
Packet: Ether / IP / TCP 52.113.194.132:https > 192.168.9.2:60870 PA / Raw | Protocol: tcp | Encryption: TLS (HTTPS)
Packet: Ether / IP / TCP 52.113.194.132:https > 192.168.9.2:60870 A / Padding | Protocol: tcp | Encryption: TLS (HTTPS)
Packet: Ether / IP / TCP 52.113.194.132:https > 192.168.9.2:60870 A / Padding | Protocol: tcp | Encryption: TLS (HTTPS)
Packet: Ether / IP / TCP 52.113.194.132:https > 192.168.9.2:60870 A / Padding | Protocol: tcp | Encryption: TLS (HTTPS)
Packet: Ether / IP / TCP 52.113.194.132:https > 192.168.9.2:60870 A / Padding | Protocol: tcp | Encryption: TLS (HTTPS)
Packet: Ether / IP / TCP 52.113.194.132:https > 192.168.9.2:60870 A / Padding | Protocol: tcp | Encryption: TLS (HTTPS)
Packet: Ether / IP / TCP 52.113.194.132:https > 192.168.9.2:60870 A / Padding | Protocol: tcp | Encryption: TLS (HTTPS)
Packet: Ether / IP / TCP 52.113.194.132:https > 192.168.9.2:60870 A / Padding | Protocol: tcp | Encryption: TLS (HTTPS)
Packet: Ether / IP / TCP 52.113.194.132:https > 192.168.9.2:60870 A / Padding | Protocol: tcp | Encryption: TLS (HTTPS)
Packet: Ether / IP / TCP 52.113.194.132:https > 192.168.9.2:60870 A / Padding | Protocol: tcp | Encryption: TLS (HTTPS)
Packet: Ether / IP / TCP 52.113.194.132:https > 192.168.9.2:60870 A / Padding | Protocol: tcp | Encryption: TLS (HTTPS)
Packet: Ether / IP / TCP 52.113.194.132:https > 192.168.9.2:60870 A / Padding | Protocol: tcp | Encryption: TLS (HTTPS)
Packet: Ether / IP / TCP 52.113.194.132:https > 192.168.9.2:60870 A / Padding | Protocol: tcp | Encryption: TLS (HTTPS)
Packet: Ether / IP / TCP 52.113.194.132:https > 192.168.9.2:60870 A / Padding | Protocol: tcp | Encryption: TLS (HTTPS)
Packet: Ether / IP / TCP 52.113.194.132:https > 192.168.9.2:60870 A / Padding | Protocol: tcp | Encryption: TLS (HTTPS)
Packet: Ether / IP / TCP 52.113.194.133:https > 192.168.9.2:60875 A / Padding | Protocol: tcp | Encryption: TLS (HTTPS)
Packet: Ether / IP / TCP 52.113.194.133:https > 192.168.9.2:60875 PA / Raw | Protocol: tcp | Encryption: TLS (HTTPS)
Packet: Ether / IP / TCP 52.113.194.133:https > 192.168.9.2:60874 A | Protocol: tcp | Encryption: TLS (HTTPS)
Packet: Ether / IP / TCP 52.113.194.133:https > 192.168.9.2:60874 A / Padding | Protocol: tcp | Encryption: TLS (HTTPS)
Packet: Ether / IP / TCP 52.113.194.133:https > 192.168.9.2:60874 PA / Raw | Protocol: tcp | Encryption: TLS (HTTPS)
Packet: Ether / IP / TCP 192.168.9.2:60875 > 52.113.194.133:https PA / Raw | Protocol: tcp | Encryption: TLS (HTTPS)
Packet: Ether / IP / TCP 192.168.9.2:60874 > 52.113.194.133:https PA / Raw | Protocol: tcp | Encryption: TLS (HTTPS)
Packet: Ether / IP / TCP 52.113.194.133:https > 192.168.9.2:60875 A / Padding | Protocol: tcp | Encryption: TLS (HTTPS)
Packet: Ether / IP / TCP 52.113.194.133:https > 192.168.9.2:60874 A / Padding | Protocol: tcp | Encryption: TLS (HTTPS)
Packet: Ether / IP / TCP 52.113.194.132:https > 192.168.9.2:60870 A / Raw | Protocol: tcp | Encryption: TLS (HTTPS)
Packet: Ether / IP / TCP 192.168.9.2:60870 > 52.113.194.132:https A | Protocol: tcp | Encryption: TLS (HTTPS)
Packet: Ether / IP / TCP 52.113.194.132:https > 192.168.9.2:60870 PA / Raw | Protocol: tcp | Encryption: TLS (HTTPS)
Packet: Ether / IP / TCP 52.113.194.133:https > 192.168.9.2:60875 A / Raw | Protocol: tcp | Encryption: TLS (HTTPS)
Packet: Ether / IP / TCP 52.113.194.133:https > 192.168.9.2:60875 A / Raw | Protocol: tcp | Encryption: TLS (HTTPS)
Packet: Ether / IP / TCP 192.168.9.2:60875 > 52.113.194.133:https A | Protocol: tcp | Encryption: TLS (HTTPS)
Packet: Ether / IP / TCP 52.113.194.133:https > 192.168.9.2:60875 A / Raw | Protocol: tcp | Encryption: TLS (HTTPS)
Packet: Ether / IP / TCP 52.113.194.133:https > 192.168.9.2:60875 A / Raw | Protocol: tcp | Encryption: TLS (HTTPS)
Packet: Ether / IP / TCP 52.113.194.133:https > 192.168.9.2:60875 PA / Raw | Protocol: tcp | Encryption: TLS (HTTPS)
Packet: Ether / IP / TCP 192.168.9.2:60875 > 52.113.194.133:https A | Protocol: tcp | Encryption: TLS (HTTPS)
Packet: Ether / IP / TCP 52.113.194.133:https > 192.168.9.2:60874 A / Raw | Protocol: tcp | Encryption: TLS (HTTPS)
Packet: Ether / IP / TCP 52.113.194.133:https > 192.168.9.2:60874 A / Raw | Protocol: tcp | Encryption: TLS (HTTPS)
Packet: Ether / IP / TCP 192.168.9.2:60874 > 52.113.194.133:https A | Protocol: tcp | Encryption: TLS (HTTPS)
Packet: Ether / IP / TCP 52.113.194.133:https > 192.168.9.2:60874 A / Raw | Protocol: tcp | Encryption: TLS (HTTPS)
Packet: Ether / IP / TCP 52.113.194.133:https > 192.168.9.2:60874 A / Raw | Protocol: tcp | Encryption: TLS (HTTPS)
Packet: Ether / IP / TCP 52.113.194.133:https > 192.168.9.2:60874 PA / Raw | Protocol: tcp | Encryption: TLS (HTTPS)
Packet: Ether / IP / TCP 192.168.9.2:60874 > 52.113.194.133:https A | Protocol: tcp | Encryption: TLS (HTTPS)
Packet: Ether / IP / TCP 52.113.194.132:https > 192.168.9.2:60870 PA / Raw | Protocol: tcp | Encryption: TLS (HTTPS)
Packet: Ether / IP / TCP 192.168.9.2:60870 > 52.113.194.132:https A | Protocol: tcp | Encryption: TLS (HTTPS)
Packet: Ether / IP / TCP 52.113.194.132:https > 192.168.9.2:60870 PA / Raw | Protocol: tcp | Encryption: TLS (HTTPS)
Packet: Ether / IP / TCP 52.113.194.132:https > 192.168.9.2:60870 PA / Raw | Protocol: tcp | Encryption: TLS (HTTPS)
Packet: Ether / IP / TCP 52.113.194.132:https > 192.168.9.2:60870 PA / Raw | Protocol: tcp | Encryption: TLS (HTTPS)
Packet: Ether / IP / TCP 192.168.9.2:60870 > 52.113.194.132:https A | Protocol: tcp | Encryption: TLS (HTTPS)
Packet: Ether / IP / TCP 52.113.194.132:https > 192.168.9.2:60870 PA / Raw | Protocol: tcp | Encryption: TLS (HTTPS)
Packet: Ether / IP / TCP 192.168.9.2:60870 > 52.113.194.132:https A | Protocol: tcp | Encryption: TLS (HTTPS)
Packet: Ether / IP / TCP 192.168.9.2:60875 > 52.113.194.133:https PA / Raw | Protocol: tcp | Encryption: TLS (HTTPS)
Packet: Ether / IP / TCP 192.168.9.2:60875 > 52.113.194.133:https PA / Raw | Protocol: tcp | Encryption: TLS (HTTPS)
Packet: Ether / IP / TCP 192.168.9.2:60874 > 52.113.194.133:https PA / Raw | Protocol: tcp | Encryption: TLS (HTTPS)
Packet: Ether / IP / TCP 192.168.9.2:60875 > 52.113.194.133:https PA / Raw | Protocol: tcp | Encryption: TLS (HTTPS)
Packet: Ether / IP / TCP 192.168.9.2:60874 > 52.113.194.133:https PA / Raw | Protocol: tcp | Encryption: TLS (HTTPS)
Packet: Ether / IP / TCP 192.168.9.2:60874 > 52.113.194.133:https PA / Raw | Protocol: tcp | Encryption: TLS (HTTPS)
Packet: Ether / IP / TCP 52.113.194.133:https > 192.168.9.2:60875 A / Padding | Protocol: tcp | Encryption: TLS (HTTPS)
Packet: Ether / IP / TCP 52.113.194.133:https > 192.168.9.2:60875 PA / Raw | Protocol: tcp | Encryption: TLS (HTTPS)
Packet: Ether / IP / TCP 52.113.194.133:https > 192.168.9.2:60875 A / Padding | Protocol: tcp | Encryption: TLS (HTTPS)
Packet: Ether / IP / TCP 52.113.194.133:https > 192.168.9.2:60875 PA / Raw | Protocol: tcp | Encryption: TLS (HTTPS)
Packet: Ether / IP / TCP 192.168.9.2:60875 > 52.113.194.133:https A | Protocol: tcp | Encryption: TLS (HTTPS)
Packet: Ether / IP / TCP 192.168.9.2:60875 > 52.113.194.133:https PA / Raw | Protocol: tcp | Encryption: TLS (HTTPS)
Packet: Ether / IP / TCP 52.113.194.133:https > 192.168.9.2:60874 A / Padding | Protocol: tcp | Encryption: TLS (HTTPS)
Packet: Ether / IP / TCP 52.113.194.133:https > 192.168.9.2:60875 PA / Raw | Protocol: tcp | Encryption: TLS (HTTPS)
Packet: Ether / IP / TCP 52.113.194.133:https > 192.168.9.2:60874 A / Padding | Protocol: tcp | Encryption: TLS (HTTPS)
Packet: Ether / IP / TCP 52.113.194.133:https > 192.168.9.2:60874 PA / Raw | Protocol: tcp | Encryption: TLS (HTTPS)
Packet: Ether / IP / TCP 52.113.194.133:https > 192.168.9.2:60874 PA / Raw | Protocol: tcp | Encryption: TLS (HTTPS)
Packet: Ether / IP / TCP 192.168.9.2:60874 > 52.113.194.133:https A | Protocol: tcp | Encryption: TLS (HTTPS)
Packet: Ether / IP / TCP 192.168.9.2:60874 > 52.113.194.133:https PA / Raw | Protocol: tcp | Encryption: TLS (HTTPS)
Packet: Ether / IP / TCP 52.113.194.133:https > 192.168.9.2:60874 PA / Raw | Protocol: tcp | Encryption: TLS (HTTPS)
Packet: Ether / IP / TCP 52.113.194.133:https > 192.168.9.2:60875 A / Padding | Protocol: tcp | Encryption: TLS (HTTPS)
Packet: Ether / IP / TCP 52.113.194.133:https > 192.168.9.2:60874 A / Padding | Protocol: tcp | Encryption: TLS (HTTPS)
Packet: Ether / IP / TCP 192.168.9.2:60870 > 52.113.194.132:https PA / Raw | Protocol: tcp | Encryption: TLS (HTTPS)
Packet: Ether / IP / TCP 192.168.9.2:60870 > 52.113.194.132:https PA / Raw | Protocol: tcp | Encryption: TLS (HTTPS)
Packet: Ether / IP / TCP 52.113.194.132:https > 192.168.9.2:60870 A / Padding | Protocol: tcp | Encryption: TLS (HTTPS)
Packet: Ether / IP / TCP 52.113.194.132:https > 192.168.9.2:60870 A / Padding | Protocol: tcp | Encryption: TLS (HTTPS)
Packet: Ether / IP / TCP 192.168.9.2:60870 > 52.113.194.132:https PA / Raw | Protocol: tcp | Encryption: TLS (HTTPS)
Packet: Ether / IP / TCP 52.113.194.132:https > 192.168.9.2:60870 A | Protocol: tcp | Encryption: TLS (HTTPS)
Packet: Ether / IP / TCP 52.113.194.132:https > 192.168.9.2:60870 A / Padding | Protocol: tcp | Encryption: TLS (HTTPS)
Packet: Ether / IP / TCP 192.168.9.2:60874 > 52.113.194.133:https A | Protocol: tcp | Encryption: TLS (HTTPS)
Packet: Ether / IP / TCP 192.168.9.2:60875 > 52.113.194.133:https A | Protocol: tcp | Encryption: TLS (HTTPS)
Packet: Ether / IP / TCP 52.113.194.132:https > 192.168.9.2:60870 A / Padding | Protocol: tcp | Encryption: TLS (HTTPS)
Packet: Ether / IP / TCP 52.113.194.132:https > 192.168.9.2:60870 A / Padding | Protocol: tcp | Encryption: TLS (HTTPS)
Packet: Ether / IP / TCP 52.113.194.132:https > 192.168.9.2:60870 A / Padding | Protocol: tcp | Encryption: TLS (HTTPS)
Packet: Ether / IP / TCP 52.113.194.132:https > 192.168.9.2:60870 A / Padding | Protocol: tcp | Encryption: TLS (HTTPS)
Packet: Ether / IP / TCP 52.113.194.133:https > 192.168.9.2:60875 PA / Raw | Protocol: tcp | Encryption: TLS (HTTPS)
Packet: Ether / IP / TCP 192.168.9.2:60876 > 52.113.194.133:https S | Protocol: tcp | Encryption: TLS (HTTPS)
Packet: Ether / IP / TCP 192.168.9.2:60877 > 52.123.129.14:https S | Protocol: tcp | Encryption: TLS (HTTPS)
Packet: Ether / IP / TCP 192.168.9.2:60870 > 52.113.194.132:https PA / Raw | Protocol: tcp | Encryption: TLS (HTTPS)
Packet: Ether / IP / TCP 192.168.9.2:60878 > 40.99.211.2:https S | Protocol: tcp | Encryption: TLS (HTTPS)
Packet: Ether / IP / TCP 192.168.9.2:60879 > 40.99.211.2:https S | Protocol: tcp | Encryption: TLS (HTTPS)
Packet: Ether / IP / TCP 52.113.194.133:https > 192.168.9.2:60876 SA | Protocol: tcp | Encryption: TLS (HTTPS)
Packet: Ether / IP / TCP 192.168.9.2:60876 > 52.113.194.133:https A | Protocol: tcp | Encryption: TLS (HTTPS)
Packet: Ether / IP / TCP 52.123.129.14:https > 192.168.9.2:60877 SA | Protocol: tcp | Encryption: TLS (HTTPS)
Packet: Ether / IP / TCP 192.168.9.2:60877 > 52.123.129.14:https A | Protocol: tcp | Encryption: TLS (HTTPS)
Packet: Ether / IP / TCP 192.168.9.2:60876 > 52.113.194.133:https PA / Raw | Protocol: tcp | Encryption: TLS (HTTPS)
Packet: Ether / IP / TCP 192.168.9.2:60877 > 52.123.129.14:https PA / Raw | Protocol: tcp | Encryption: TLS (HTTPS)
Packet: Ether / IP / TCP 192.168.9.2:60870 > 52.113.194.132:https PA / Raw | Protocol: tcp | Encryption: TLS (HTTPS)
Packet: Ether / IP / TCP 52.113.194.132:https > 192.168.9.2:60870 A / Padding | Protocol: tcp | Encryption: TLS (HTTPS)
Packet: Ether / IP / TCP 52.113.194.132:https > 192.168.9.2:60870 A / Padding | Protocol: tcp | Encryption: TLS (HTTPS)
Packet: Ether / IP / TCP 52.113.194.132:https > 192.168.9.2:60870 A / Padding | Protocol: tcp | Encryption: TLS (HTTPS)
Packet: Ether / IP / TCP 52.113.194.132:https > 192.168.9.2:60870 PA / Raw | Protocol: tcp | Encryption: TLS (HTTPS)
Packet: Ether / IP / TCP 52.113.194.132:https > 192.168.9.2:60870 PA / Raw | Protocol: tcp | Encryption: TLS (HTTPS)
Packet: Ether / IP / TCP 192.168.9.2:60870 > 52.113.194.132:https A | Protocol: tcp | Encryption: TLS (HTTPS)
Packet: Ether / IP / TCP 52.113.194.132:https > 192.168.9.2:60870 PA / Raw | Protocol: tcp | Encryption: TLS (HTTPS)
Packet: Ether / IP / TCP 52.113.194.132:https > 192.168.9.2:60870 PA / Raw | Protocol: tcp | Encryption: TLS (HTTPS)
Packet: Ether / IP / TCP 192.168.9.2:60870 > 52.113.194.132:https A | Protocol: tcp | Encryption: TLS (HTTPS)
Packet: Ether / IP / TCP 40.99.211.2:https > 192.168.9.2:60878 SA | Protocol: tcp | Encryption: TLS (HTTPS)
Packet: Ether / IP / TCP 192.168.9.2:60878 > 40.99.211.2:https A | Protocol: tcp | Encryption: TLS (HTTPS)
Packet: Ether / IP / TCP 40.99.211.2:https > 192.168.9.2:60879 SA | Protocol: tcp | Encryption: TLS (HTTPS)
Packet: Ether / IP / TCP 192.168.9.2:60879 > 40.99.211.2:https A | Protocol: tcp | Encryption: TLS (HTTPS)
Packet: Ether / IP / TCP 192.168.9.2:60880 > 135.225.242.134:https S | Protocol: tcp | Encryption: TLS (HTTPS)
Packet: Ether / IP / TCP 52.113.194.133:https > 192.168.9.2:60876 A / Padding | Protocol: tcp | Encryption: TLS (HTTPS)
Packet: Ether / IP / TCP 52.113.194.133:https > 192.168.9.2:60876 PA / Raw | Protocol: tcp | Encryption: TLS (HTTPS)
Packet: Ether / IP / TCP 52.123.129.14:https > 192.168.9.2:60877 A / Padding | Protocol: tcp | Encryption: TLS (HTTPS)
Packet: Ether / IP / TCP 192.168.9.2:60878 > 40.99.211.2:https PA / Raw | Protocol: tcp | Encryption: TLS (HTTPS)
Packet: Ether / IP / TCP 192.168.9.2:60879 > 40.99.211.2:https PA / Raw | Protocol: tcp | Encryption: TLS (HTTPS)
Packet: Ether / IP / TCP 52.123.129.14:https > 192.168.9.2:60877 A / Padding | Protocol: tcp | Encryption: TLS (HTTPS)
